{
  "dcp_version": "1.0",
  "message_id": "msg_01HZ0DEPCREATED01",
  "message_type": "dependency.created",
  "issued_at": "2026-06-29T10:05:00Z",
  "body": {
    "event_id": "evt_01HZ0DEPCREATED01",
    "entity_type": "dependency",
    "verb": "created",
    "entity_id": "dep_examples_need_schemas",
    "entity": {
      "id": "dep_examples_need_schemas",
      "from_id": "task_write_examples",
      "to_id": "task_schema_validation",
      "dependency_type": "requires",
      "description": "Examples can only be authored once the schemas they validate against exist."
    }
  }
}
