{
  "dcp_version": "1.0",
  "message_id": "msg_01HZ0TASKCREATED1",
  "message_type": "task.created",
  "issued_at": "2026-06-29T10:01:00Z",
  "correlation_id": "msg_01HZ0PROJECT0001",
  "body": {
    "event_id": "evt_01HZ0TASKCREATED1",
    "entity_type": "task",
    "verb": "created",
    "entity_id": "task_schema_validation",
    "attributed_to": "agent-builder",
    "entity": {
      "id": "task_schema_validation",
      "project_id": "project_dcp",
      "title": "Implement DCP schema validation",
      "description": "Author the JSON Schema 2020-12 documents for the envelope, event, and eight entities.",
      "status": "todo",
      "priority": "high"
    }
  }
}
