{
  "dcp_version": "1.0",
  "message_id": "msg_aw_01JZK0003b",
  "message_type": "task.completed",
  "issued_at": "2026-07-03T06:31:00Z",
  "correlation_id": "msg_aw_01JZK0001",
  "body": {
    "event_id": "evt_aw_01JZK0003b",
    "entity_type": "task",
    "verb": "completed",
    "entity_id": "task_awjob_7f3a9c",
    "project_id": "project_aw_tokonomix_rail",
    "attributed_to": "worker_tokonomix_w17",
    "delta": {
      "status": {
        "from": "leased",
        "to": "completed"
      }
    },
    "extensions": {
      "x-agentsweaver": {
        "actual_cost_micros": 187500,
        "reservation_id": "resv_9d1e2f",
        "receipt_ref": "receipt_aw_5c22e1",
        "settle_state": "settled",
        "cost_disclosure": "opt_in_bilateral",
        "disclosure_note": "cost fields visible to every stream consumer; bilateral restriction must be enforced by the transport channel, not by this marker",
        "attempt": 1
      }
    },
    "occurred_at": "2026-07-03T06:30:57Z"
  }
}