{
  "dcp_version": "1.0",
  "message_id": "msg_uverb01",
  "message_type": "task.archived",
  "issued_at": "2026-06-29T10:00:00Z",
  "body": {
    "event_id": "evt_uverb01",
    "entity_type": "task",
    "verb": "archived",
    "entity_id": "task_x",
    "refs": [
      {
        "rel": "relates_to",
        "ref": "project_x"
      }
    ]
  }
}
