{
  "dcp_version": "1.0",
  "message_id": "msg_ustat01",
  "message_type": "task.snapshot",
  "issued_at": "2026-06-29T10:00:00Z",
  "body": {
    "event_id": "evt_ustat01",
    "entity_type": "task",
    "verb": "snapshot",
    "entity_id": "task_x",
    "entity": {
      "id": "task_x",
      "project_id": "project_x",
      "title": "A task",
      "status": "on_hold"
    }
  }
}
